{"document_summary":"Bài khảo luận trình bày thế giới quan Phật học trên nền tảng giáo lý nhân duyên và nhân quả. Tác giả đối chiếu lập trường Phật giáo với ba khuynh hướng tư tưởng Ấn Độ cổ là túc mệnh luận, thần ý luận và ngẫu nhiên luận, cho rằng các thuyết ấy không thể đặt nền tảng cho trách nhiệm đạo đức và con đường giải thoát. Từ đó, bài viết giải thích duyên khởi như nguyên lý cấu thành mọi hiện tượng, phân biệt đồng thời nhân quả và dị thời nhân quả, rồi mở rộng đến ý nghĩa liên hệ giữa một và tất cả trong vũ trụ cũng như giá trị nhân sinh của thế giới quan Phật giáo.","document_metadata":"Nhan đề: Vũ-trụ-quan Phật học. Tác giả ký Thạc-Đức, bút danh gắn với Thích Nhất Hạnh trong giai đoạn đầu của tạp chí Phật Giáo Việt Nam. Văn bản đăng trên tạp chí Phật Giáo Việt Nam, số 17-18, năm 1957, hiện được số hóa bởi Thư Viện Huệ Quang. Thể loại: khảo luận Phật học. Chủ đề chính: giáo lý nhân duyên, nhân quả, duyên khởi, thế giới quan Phật giáo và ý nghĩa nhân sinh của nó trong tương quan với các trào lưu tư tưởng Ấn Độ cổ.","dublin_core":{"title":"Vũ-trụ-quan Phật học","creator":"Thạc-Đức","subject":"Thế giới quan Phật giáo, nhân duyên, nhân quả, duyên khởi, triết học Ấn Độ cổ","description":"Bài khảo luận phân tích nguyên lý nhân duyên của Phật giáo, phê bình các thuyết túc mệnh, thần ý và ngẫu nhiên, đồng thời trình bày đồng thời nhân quả, dị thời nhân quả và ý nghĩa nhân sinh của duyên khởi.","publisher":"Tạp chí Phật Giáo Việt Nam","contributor":"Thư Viện Huệ Quang số hóa","date":"1957","type":"Khảo luận Phật học","format":"Văn bản in số hóa","identifier":"Phật Giáo Việt Nam, số 17-18","source":"Tạp chí Phật Giáo Việt Nam, số 17-18, năm 1957","language":"vi","relation":"Gắn với giai đoạn trước tác đầu của Thích Nhất Hạnh dưới bút danh Thạc-Đức","coverage":"Bối cảnh tư tưởng Ấn Độ cổ và giáo lý Phật giáo về vũ trụ, nhân sinh","rights":"Tư liệu số hóa bởi Thư Viện Huệ Quang"},"key_concepts":["vũ trụ quan Phật học","nhân duyên","duyên khởi","nhân quả","đồng thời nhân quả","dị thời nhân quả","túc mệnh luận","thần ý luận","ngẫu nhiên luận","lục căn lục trần","Danh Sắc và Thức","Thập nhị nhân duyên","vô thường","liên hệ giữa một và tất cả","trách nhiệm đạo đức cá nhân","giải thoát"],"narrative_context":"Bài viết thuộc mạch khảo luận Phật học Việt Nam giữa thế kỷ XX, nhằm trình bày Phật pháp như một thế giới quan vừa có giá trị triết học vừa có ý nghĩa thực tiễn cho đời sống con người. Tác giả xuất phát từ bối cảnh tranh luận tư tưởng Ấn Độ thời đức Phật để nêu bật tính đặc thù của lập trường duyên khởi: không quy định mệnh bởi định mệnh hay thần linh, cũng không rơi vào ngẫu nhiên vô trật tự. Từ nền tảng ấy, bài viết triển khai giáo lý nhân duyên như nguyên lý phổ quát của thế giới hiện tượng, giải thích cấu trúc nhận thức và sự liên tục của sinh mệnh, rồi kết lại bằng viễn tượng trùng trùng duyên khởi, nơi một pháp tương quan với toàn thể. Đây là một bài vừa mang tính giới thiệu giáo lý, vừa có ý hướng chấn chỉnh nhận thức triết học và đạo đức của độc giả Phật giáo đương thời.","language":"vi","sections":[{"start_line":1,"end_line":47,"title":"Mở đầu: các khuynh hướng tư tưởng Ấn Độ và lập trường của đức Phật","title_en":"Introduction: Indian philosophical trends and the Buddha's standpoint","title_orig":"VŨ-TRỤ-QUAN PHAT-HOC","summary":"Phần mở đầu nêu bối cảnh tư tưởng Ấn Độ thời đức Phật với ba khuynh hướng lớn: túc mệnh luận, thần ý luận và ngẫu nhiên luận. Tác giả phê bình cả ba vì đều không thể thiết lập trách nhiệm đạo đức cá nhân và không mở ra một con đường nhân sinh tích cực. Từ đó, bài viết xác định lập trường của đức Phật là trình bày nguyên lý vũ trụ như nền tảng cho đạo đức và giải thoát.","keywords":["tư tưởng Ấn Độ cổ","túc mệnh luận","thần ý luận","ngẫu nhiên luận","trách nhiệm đạo đức","lập trường của đức Phật"]},{"start_line":48,"end_line":91,"title":"Nguyên lý nhân duyên và cấu trúc nhân quả của thế giới","title_en":"Dependent origination and the causal structure of the world","title_orig":"Thế giới quan mà đức Phật thuyết minh là thế giới quan nhân duyên","summary":"Phần này giới thiệu trực tiếp thế giới quan nhân duyên, định nghĩa công thức duyên khởi và giải thích quan hệ giữa các pháp trong đồng thời và dị thời. Tác giả nhấn mạnh rằng không có pháp nào tồn tại độc lập hay tuyệt đối; mọi hiện tượng đều là hữu vi, vô thường và được thành lập trong mạng lưới liên hệ. Phần cuối liên hệ giáo lý này với truyền thống A-hàm, A-tỳ-đạt-ma và Hoa Nghiêm.","keywords":["nhân duyên","duyên khởi","nhân quả","hữu vi pháp","vô thường","Hoa Nghiêm","A-tỳ-đạt-ma"]},{"start_line":92,"end_line":121,"title":"Đồng thời nhân quả: thế giới như tương quan giữa chủ quan và khách quan","title_en":"Simultaneous causality: the world as relation between subject and object","title_orig":"1_ Vấn-đề đồng thời nhân quả","summary":"Phần này triển khai đồng thời nhân quả qua giáo lý lục căn và lục trần, cho rằng thế giới chỉ thành lập trong sự giao tiếp giữa năng lực nhận thức và đối tượng nhận thức. Tác giả dùng hình ảnh hai cây lau nương nhau để giải thích quan hệ giữa Danh Sắc và Thức. Qua đó, thế giới hiện ra như một cấu trúc tương duyên, không có chủ thể hay khách thể nào tồn tại riêng lẻ.","keywords":["đồng thời nhân quả","lục căn lục trần","chủ quan và khách quan","Danh Sắc","Thức","tương quan nhận thức"]},{"start_line":122,"end_line":145,"title":"Dị thời nhân quả: sự liên tục của sinh mệnh và nghiệp báo","title_en":"Successive causality: continuity of life and karmic fruition","title_orig":"2. Vấn đề dị thời nhân quả","summary":"Phần này bàn về dị thời nhân quả như nguyên lý giải thích sự liên tục của hiện tượng và đặc biệt của đời sống hữu tình. Tác giả nhấn mạnh vô thường không đồng nghĩa với đoạn diệt, vì luôn có những dòng hiện tượng tiếp nối theo quy luật. Các khái niệm vô minh, ái dục, nghiệp nhân, dị thục và Thập nhị nhân duyên được dẫn ra để cho thấy chiều sâu tâm lý, luận lý và siêu hình của giáo lý Phật giáo.","keywords":["dị thời nhân quả","liên tục tồn tại","luân hồi sinh tử","vô minh","ái dục","nghiệp","dị thục","Thập nhị nhân duyên"]},{"start_line":146,"end_line":177,"title":"Một và tất cả: ý nghĩa toàn thể của duyên khởi","title_en":"One and all: the total meaning of dependent origination","title_orig":"qua Một","summary":"Phần kết mở rộng quan niệm nhân quả thành viễn tượng trùng trùng duyên khởi, nơi một pháp nhỏ nhất cũng liên hệ đến toàn thể vũ trụ. Tác giả trích dẫn thơ thiền để diễn tả mối tương dung giữa cái vi tế và cái vô cùng, rồi khẳng định đây là nhận định căn bản của đạo Phật. Kết thúc bài, tác giả liên hệ giáo lý duyên khởi với sự phát triển của khoa học hiện đại và bày tỏ hy vọng nó sẽ phá trừ các quan niệm sai lạc về định mệnh, ngẫu nhiên và thần tạo.","keywords":["một và tất cả","trùng trùng duyên khởi","thiền học Việt Nam","toàn thể và cá thể","khoa học hiện đại","ý nghĩa nhân sinh"]}]}